{
  "stock_id": "2382",
  "as_of": "2025-12-31",
  "moment_type": "institution_community_divergence",
  "anomaly_score": 0.87,
  "severity": "attention",
  "evidence": {
    "close": 272,
    "annual_return": -0.007,
    "institutional_net_20d": -60265,
    "community_bullish_ratio_7d": 0.939,
    "community_ratio_scope": "explicit_bullish_or_bearish_posts_only"
  },
  "model_version": "moment-detector-demo-v1"
}
